{
  "version": "2.0",
  "patient_id": "patient-001",
  "scenario": "sepsis",
  "scenario_stage": "sepsis_onset",
  "timestamp": 1746376800000,
  "hr": 102.5,
  "bp_sys": 95.0,
  "bp_dia": 62.0,
  "o2_sat": 94.2,
  "temperature": 38.7,
  "respiratory_rate": 22.0,
  "wbc": 13.4,
  "lactate": 2.3,
  "creatinine": 1.8,
  "altered_mentation": true,
  "sirs_score": 3,
  "qsofa_score": 2,
  "sepsis_stage": "sepsis",
  "sepsis_onset_ts": 1746376500000,
  "quality": "good",
  "source": "synthea-simulator"
}
